orgao,link,titulo,reclamacao
http://http://www.integracao.gov.br,https://cidadao.reclameaqui.com.br/278282/ministerio-da-integracao-nacional/teg/,teg ," 
        boa noite! bom gostaria de reclamar sobre os condutores do teg ,pois neium desse inrrespossavel querem buscar meus filhos em minha residência pois já conversei com vários, minha filha estuda no emei ceu alvarenga e meu filho na escola padre aldo da tofóre ,pois ja falei com varios condutores e ninguém quer pega los, ja falei com o tal do tio dede ,tio milton ,tio carlos,tio prospero,tio marcio esse inrresponsavel nao querem trabalhar so guanhar dinheiro pq nunca vi tanta falta de consideração com os alunos e pais.
espero que resolva isso pq meus filhos tem o direito do transporte escolar sem contar que eles estao combrando pais de alunos para busca espero que se resolva .         "
http://http://www.integracao.gov.br,https://cidadao.reclameaqui.com.br/226800/ministerio-da-integracao-nacional/tarifa-social-de-energia-eletrica/,Tarifa Social de Energia Eletrica ," 
        Há 3 meses passados eu era beneficiada pela tarifa social de energia elétrica, perdi o beneficio e até hoje não sei por que?A cia de energia CPFL me mandou uma carta me comunicando que eu deveria atualizar meu cadastro junto a prefeitura da cidade e o cras. Foi o que fiz, mas de nada adiantou, entrei em contado com o Ministério de desenvolvimento social (MDS), ficaram de mandar um Email e estou esperanado até agoraO fato é que eu não preciso ser cadastrada em nenhum cadastro social, pois tenho direito a essa tarifa, pois pesquisando no site do governo, achei o www.guia de direitos.org que  diz que quem consome entre 80 a 120(kwh) mensal, e que não ultrapasse disso mais que 2x, esse consumo no ano ja tem o direito automaticamante sem precisar de qualquer cadastro social.Eu me enquadro perfeitamente nessa condição uma vez que o meu maior gasto e de 106(kwh)mes
Obrigada fico aguardando resposta         "
http://http://www.integracao.gov.br,https://cidadao.reclameaqui.com.br/334623/ministerio-da-integracao-nacional/querem-que-eu-assine-um-documento-como-recebido-para-somente/,QUEREM QUE EU ASSINE UM DOCUMENTO  COMO RECEBIDO PARA SOMENTE APOS ISSO ENTREGAR ," 
        senhores, A SERVENG QUER QUE EU ASSINE DOCUMENTO SEM ME ENTREGAR O MATERIAL, SE JA SE PASARAM MAIS DE UM ANO QUE NÃO RESOLVEM , COMO VOU ASSINAR NOVO DOCUMENTO SEM MENCIONAR QUE A ENTREGA SERÁ FEITA POSTERIOR?  NÃO POSSO DEIXAR DE PENSAR QUE QUEREM QUE EU ASSINE COMO RECEBIDO E DEPOIS NÃO ENTREGARÃO.
Olha o texto:
TERMO DE RECEBIMENTO DE MATERIAL
Pelo presente instrumento partícula, Eu FRANCISCO DA SILVA recebi da SERVENG - CIVILSAN S.A. CNPJ 48.540.421/0001-31, 208 estacas de concreto, 14 mourões de concreto, 28 escoras de concreto e 2.780m lineares de arame farpado equivalente a 5 rolos de fios.
Assim dou como quitado os prejuízos a mim causados na cerca de aproximadamente 560m da minha propriedade localizada a margem da estrada do Sítio Beleza, município de Jati/CE.
Em acordo com os materiais recebidos assino o recebimento dos materiais e declaro está satisfeito. 
Brejo Santo/CE, 24 de Abril de 2017.
FRANCISCO JUSSIMAR FURTADO DA SILVA
FIZ RECLAMAÇÕES SOBRE A CERCA DA MINHA PROPRIEDADE QUE UMA OBRA DO MINISTERIO DA INTEGRAÇÃO NACIONAL ESTA FAZENDO NO MUNICIPIO DE JATI-CEARA, EM RESUMO ESSA EMPRESA SERVENG, COLOCOU UM BRITADOR PROXIMO A MINHA PROPRIEDADE E COMEÇOU A PASSAR MOTONIVELADORAS DIARIAMENTE PARA ARRUMAR A ESTRADA VICINAL. FORAM PASSANDO E LEVANDO A ENGORDA DE TERRA ATE CHEGAREM AO PONTO QUE SÓ TEM MINHA CERCA PARA CAIR. DERRUBARAM A CERCA VARIAS VEZES E EU FUI CONSERTANDO. NA PRIMEIRA VEZ QUE RECLAMEI FORAM LA E FIZERAM UM FAZ DE CONTA NA CERCA. NÃO RESOLVEU, POIS AS MAQUINAS CONTINUARAM DERRUBANDO. ME FIZERAM UMA PROPOSTA DE ME DAREM O MATERIAL DA CERCA PARA QUE EU ENTRASSE COM A MÃO DE OBRA. OS TECNICOS DA EMPRESA E DO MINISTERIO DA INTEGRAÇÃO PEDIRAM PARA QUE EU FIZESSE UM DOCUMENTO COMCORDANDO COM O NEGOCIO. POREM SUMIRAM. AGORA QUASE UM ANO DEPOIS ME DIZEM QUE VÃO VOLTAR LA PARA NOVO LEVANTAMENTO. AGORA SOLICITO A REENGORDA DO MATERIAL QUE ELES LEVARAM, O QUE HOJE FAZ COM QUE A CERCA NÃO FIQUE MAIS EM PÉ. VOU ENTRAR COM UMA AÇÃO CONTRA A EMPRESA E O MINISTERIO DA INTEGRAÇÃO.         "
http://http://www.integracao.gov.br,https://cidadao.reclameaqui.com.br/222751/ministerio-da-integracao-nacional/recadastramento-do-fies/,Recadastramento do FIES ," 
        Minha inscrição no FIES terminou o prazo dia 09/03 e desde então tento que eles reabram minha ficha de inscrição para que eu posso renova-la meu número de processo e 871.830  protocolo 2015000342569, tento falar no site do MEC , porém não reconhece nenhuma senha que coloco .
Preciso desse financiamento para fazer a faculdade . E somente desbloquiar minha pagina 
obrigado 
Lucineide Medeiros de Souza 
903343707-44         "
http://http://www.integracao.gov.br,https://cidadao.reclameaqui.com.br/221653/ministerio-da-integracao-nacional/endereco-errado/,Endereço errado ," 
        Boa tarde!
Gostaria de fazer uma reclamação, deveriam organizar melhor os endereços , pois precisei de ir em dois SINE hoje pois o endereço que constava no site não existia. Por gentileza tomar mais cuidado com isso não tenho tempo para ficar perdendo indo atrás de endereço errado. Arrumem isso.         "
http://http://www.esporte.gov.br/ouvidoria,https://cidadao.reclameaqui.com.br/300530/ministerio-do-esporte/nao-divulga-o-edital-e-nao-atende-telefonemas-sobre-o-progra/,Não divulga o edital e não atende telefonemas sobre o Programa Bolsa - Atleta ," 
        Venho tentando me comunicar com o departamento responsável pelo programa Bolsa - Atleta há mais de um mês, nos telefones indicados no site do Ministério do Esporte. Telefones (61) 3429 - 6906 e (61) 3429 - 6867.
Não consigo obter informações sobre as inscrições de atletas, de modalidades esportivas não olímpicas, no Programa Bolsa Atleta e o Ministério do Esporte, ainda não divulgou os editais de  inscrições esse ano.
Essa falta de comunicação e acesso à informação inviabiliza os atletas a se inscreverem no Programa Bolsa - Atleta, criado a partir da Lei no 10.891, de 9 de julho de 2004.         "
http://http://www.esporte.gov.br/ouvidoria,https://cidadao.reclameaqui.com.br/256182/ministerio-do-esporte/vila-olimpica-mario-covas-sp-esta-abandonada/,Vila Olímpica Mário Covas SP está abandonada! ," 
        Bom dia,
Meu nome é Katia e sou moradora do Parque Ypê, cep: 05571-070
Gostaria de utilizar a Vila Olímpica porém, o estado em que se encontra é precário!
Falta iluminação adequada, bebedouros quebrados, pouco policiamento e serviço de limpeza, não tem bancos, brinquedos enferrujados e quebrados, buracos pelo calçamento e rua, grades das quadras enferrujadas e quebradas, vestiários imundos e mal cuidados, entre outros inúmeros problemas.
No geral, o espaço é enorme, porém mal aproveitado e cuidado. 
Gostaríamos de usar o local em horário estendido, até as 20 horas no mínimo, pois somos trabalhadores e não voltamos para casa antes das 18 horas.
Aguardo retorno urgente!
Obrigada,
Site da Vila Olímpica Mario Covas: http://www.sejel.sp.gov.br/vilaolimpica/         "
http://http://www.esporte.gov.br/ouvidoria,https://cidadao.reclameaqui.com.br/230854/ministerio-do-esporte/mudanca-de-regras-no-decorrer-do-jogo/,Mudança de regras no decorrer do jogo. ," 
        Não vou falar de partido político ou da roubalheira promovida pelo atual governo.
Apenas vou tratar de sonhos. No ano passado, jovens de várias idades foram ao 
Campeonato Brasileiro de Tênis de Mesa em busca de pódio, por realização pessoal
mas também apostando na continuidade do treinamento e das competições através do 
Bolsa Atleta.
No ano passado, estes mesmos jovens foram contemplados e este ano, apesar de conseguirem 
novamente o pódio e ter saído Nota Oficial na CBTM de que teriam direito, o Ministério dos Esportes 
simplesmente cancelou as categorias de Equipes de Clubes sem aviso prévio e informou apenas 
no dia de início das inscrições causando grande transtorno aos atletas.
Lamentável postura. Após consultar um advogado, verifiquei que cabe processo.         "
http://http://www.esporte.gov.br/ouvidoria,https://cidadao.reclameaqui.com.br/227769/ministerio-do-esporte/cartao-refeicao-pass/,Cartão Refeição Pass ," 
        Participei em Curitiba como voluntário da Copa do Mundo Fifa 2014.
Mas infelizmente perdi o meu cartão REFEIÇÃO PASS.  Localizei na semana 
passada, mas qual não foi a minha surpresa,  que o mesmo encontrava-se cancelado.
Liguei dia 07/01/2015, para o Ministério do Esporte e fui 
informando que os créditos que haviam sido colocados em meu cartão, em razão de minha participação 
no evento, foram cancelados. A servidora informou que não é possível utilizar o cartão pois os 
valores não utilizados, já foram devolvidos para o Ministério do Esporte.
Com isso estou indignado com a situação e aguardo uma resposta de como 
poderei utilizar tais créditos.
Em 07/012015 encaminhei um e-mail para o Ministério do Esporte e não obtive resposta. Uma total falta de respeito 
a qeul se dedicou como voluntário;
Atenciosamente
Sergio Luiz Czajka
CPF: 402.626.349-53         "
http://http://www.esporte.gov.br/ouvidoria,https://cidadao.reclameaqui.com.br/249355/ministerio-do-esporte/morosidade-e-prevaricacao/,MOROSIDADE E PREVARICAÇÃO ," 
        Duque de Caxias  Data: 08/08/15 
Envolvidos: PREFEITURA DE DUQUE DE CAXIAS E CAIXA ECONOMICA FEDERAL  Hora: 18:00 
Descrição: a empresa PH PAES CONSTRUÇÕES LTDA vem através deste denunciar , o BANCO CAIXA ECONÔMICA FEDERAL E A PREFEITURA MUNICIPAL DE DUQUE DE CAXIAS, POR CRIME DE PREVERICAÇÃO ENTRE OUTROS MAIS ,e solicitar soluções e medidas urgentes MINISTERIO DOS ESPORTES , sobre o Convenio da Caixa Econômica Federal com a Prefeitura de Duque de Caxias, convenio: 0232178.36/2007 de 12 dezembro 2007 Processo da PH PAES com a Prefeitura: tomada de preço 034/2008 Processo: 00060847/2007.02 de 26/10/2007 Empenho: 001913 - AGÊNCIA DA CAIXA 1334 25 de agosto ,RJ CONTA CORRENTE :006.647.036-8 onde está Depositado recurso no valor de 1.200.000,00 ( um milhão de duzentos mil reais) e a conta partida por conta da Prefeitura de Duque de Caxias que não foi depositado o valor de R$ 240.000,00 (duzentos e quarenta mil reais ) sendo que decorrido todos estes anos que o convenio está depositado na Caixa Econômica , acrescido juros o valor está em R$ 1.516.651,98 até 10/07/2012 ( um milhão quinhentos e dezesseis mil e seiscentos e cinquenta e um reais e noventa e oito centavos ) UMA VES QUE O PROCESSO SE ENCONTRA OU ENCONTRAVA-SE  NO TRIBUNAL CONTAS COMO TIVEMOS INFORMAÇÃO, E MENTIRÃO AO TRIBUNAL CONTAS, INFORMANDO QUE NÃO EXISTIA MAIS MEDIÇÃO PARA PAGAR EM ANDAMENTO , MAIS AINDA TINHA A GLOSA DA PRIMEIRA MEDIÇÃO E  A TERCEIRA MEDIÇÃO SEM O MUNICIPIO PAGAR A EMPRESA PH PAES CONSTRUÇÕES LTDA 
 OFICIO MANDO DA PREFEITURA PARA TRIBUNAL CONTAS OFICIO N 292/SMEL/2012
  JUSTIFICATIVA :
 I. VENHO INFORMA QUE A EMPRESA EM TELA tem um Contrato vigente com a Prefeitura de Duque de Caxias ou seja e um convenio entre o Banco Caixa Econômica Federal e Prefeitura de Duque de Caxias, já que a verba e federal, GANHAMOS UMA LICITAÇÃO DE 13 CAMPO DE GRAMA SINTÉTICA que ao longo de cinco anos, recebemos os valores referente só parte dos 04 campos do total 08 campos concluído sem correção nenhuma dos valores estipulado em contrato, clausula quinta, parágrafo segundo, os valores dos pagamentos eventualmente efetuados com atraso sofrerá a incidência de juros 1% (um por cento) ao mês , calculado pro rata die entre o 31º(trigésimo primeiro) dia da data do protocolo do documento de cobrança na Secretaria Municipal de Obras e a data do efetivo pagamento .
 II. depois que protocolamos os pedidos de pagamento dos 04 primeiros Campos e atestado os serviços e liberados para pagamento , pela fiscalização da Caixa Econômica Federal e Prefeitura de Duque de Caxias , após passado vários meses das solicitação de pagamentos, tivemos informação da Prefeitura que a Caixa Econômica a GIGOV do centro do RIO JANEIRO não iria desbloquear os valores liberados para pagamento, informado pela Secretaria de Esporte e Lazer que a Prefeitura não envio as documentação solicitadas na assinatura do convenio, como um deles entre outros o RGI dos local onde foi feito as obras , sendo assim ficando toda verba já depositada bloqueada até mesmo após as obras já pronta
 III. então venho solicita TRIBUNAL CONTAS RJ OU OUTROS ORGÃO COPETENTE, que tomem medidas urgentes contra a Caixa Econômica e a Prefeitura de Duque de Caxias , porque se não foi enviado a documentação na assinatura do convenio entre a Prefeitura de Caxias e a Caixa Econômica Federal, a Caixa não poderia autorizar a ordem de serviço para execução da obra para Prefeitura de Duque de Caxias , e a secretaria de obras de Caxias não poderia autorizar o memorando do início das obras para PH PAES , que estava com toda documentação na época 100% em dia na assinatura do contrato com a Prefeitura de Duque de Caxias , a Empresa PH PAES sendo informada da falta dos documento da Prefeitura com a Caixa só após as obras medidas e atestada para pagamento, INFORMO, QUE JÁ EXISTE DOIS PROCESSO CIVEL NA COMARCA DE DUQUE DE CAXIAS : 2º vara cível nº 0079288-75.2013.8.19.0021 dano moral e responsabilidade da administração o outro e na 5º vara civil nº 0079289-60.2013.8.19.0021 execução contra a fazenda pública.
 IV. Devido à falta de pagamento da Prefeitura e Caixa com a Empresa PH PAES, baseado na lei 8.866, de 21 de junho de 1993 sento que após 90 dias de atraso do pagamento das notas emitidas e atestadas, a obra pode ser paralisada sendo o contratante notificado por escrito, o que foi feito. A notificação a Prefeitura Protocolo: 058275 de 03/08/2009,
 o serviço foi executado para a PREFEITURA DE DUQUE DE CAXIAS, informamos também consta três medições a primeira de R$108.864,72 Protocolo : 57391 de 17/07/2008, valor que foi liberado em 19/08/2008 com o oficio emitido pela CAIXA para PREFEITURA ( OF SR RJ OESTE 01074/08 ) que foi pago o valor de R$ 43.924,33 ,(quarenta e três mil novecentos e vinte quatro reais e trinta e três centavos) e pago em 29/12/2011 , a EMPRESA PH PAES não recebeu nenhuma correção do valor, restando a PH PAES receber ainda o valor de R$ 64.940,39 (sessenta e quatro mil novecentos e quarenta reais e trinta e nove centavos ) do valor integral da nota, que não sei porque a caixa só liberou R$ 39.000,00 ( trinta e nove mil reais ) , pago a PH PAES o valor de R$ 29.500,77 (vinte e nove mil e quinhentos reais e setenta e sete centavos ) em 08/05/2015 sem correção do valor, o que nos foi informado na Secretaria de Esporte lazer por Dr. Arlindo e Secretaria de convênios SUPRE, junta a Secretaria de Obras, por Everton, que o convenio já tinha sido devolvido ao governo federal , que era para ir até a secretaria de Fazenda procurar o senhor ( JAIR ) contas a pagar e ver o que tinha ocorrido por não ser depositado o valor liberado integral e verificar o valor real dos desconto de impostos, segundo o senhor JAIR ele desconto o iss do valor total da nota ,porque a lei manda isto, e alguma outra coisa que faltava de outro pagamento, eu então o questionei que como foi descontado o iss da nota toda que não recebemos a nota por inteira ainda , e o valor do iss todo desta nota seria R$ 5.443,23, ele me falou que tinha uma informação que no outro pagamento anterior não foi descontado o iss da nota , eu questionei novamente que então foi erro do município, como paga uma nota e não desconta o iss da nota, e porque não pagarão os valores com atualização dos juros em contrato de todos o valores já recebido com atraso, por erro do município , e devolverão o convenio com a terceira medição sem a caixa ter liberado o pagamento, ele me falou que só faz o que mandão ele fazer , era para eu protocolar na secretaria de esportes lazer , um questionamento falando sobre o caso , mesmo assim ele não me mostrou nenhum documento informando o que foi realmente descontado no valor liberado, E TIVE INFORMARÇÃO DA CAIXA COM A OUVIDORIA DA GIGOV, ONDE CUIDA DO REFERIDO CONVENIO , MARCOS REBELO DA OUVIDORIA DA CAIXA TEL: 21-3980-3754 DIA 20/05/2015 AS 16:36 QUE O CONVENIO NÃO FOI DEVOLVIDO, QUE O MUNICIPIO ESTAVA TENTANDO DEVOLVER O VALOR PARA O MINISTERIO DE ORIGEM, SEM PAGA MULTAS E TAXAS DA QUEBRA DE CONTRATO COM A CAIXA , E EU DESCONFIO QUE ISTO E UMA ESTRAGEGIA DO MUNCIPIO DE CAXIAS PARA NAO TER O NOME NEGATIVADO NO SIAF, UMA VES QUE ANTES DA LIBERAÇÃO DO ULTIMO VALOR DOS R$ 39,000,00 O MESMO ESTAVA NEGATIVADO POR CONTA DA FALTA DE PAGAMENTO DAS MEDIÇÕES E PRESTAÇÃO DE CONTAS DO CONVENIO, TIREI NA INTERNET O RELARIO DESTE CONVENIO QUE EM 12/12/2008 FOI LIBERADO O VALOR DE R$ 600,000,00 E EM 14/05/2015 OUTRO VALOR LIBERADO R$ 1.200,000,00 PARA ONDE FOI O DINHEIRO , NÃO SABEMOS AINDA .
 V. Segunda medição de R$197.535,24. Protocolo: 055376 de 11/08/2009 a medições e referente ao restante do pagamento que falto dos 04 campos da 1º medição, Caixa Econômica Federal oficio nº 383/SMEU-CPGC/2012 Valor pago em 02/08/2012 R$ 198.325,62 (Cento e noventa e oito mil trezentos e vinte cinco reais e sessenta e dois centavos) pagamento sem os devidos valores atualizados de juros corretos.
 VI. valor referente a terceira medição dos 04 ultimo campo R$ 566.403,13 ( quinhentos e sessenta e seis mil e quatrocentos e três reais e treze centavos) Protocolo: 061721 de 05/11/2008 e o referido processo na época ficou sem andamento na secretaria de obras, sendo o mesmo reiterado o pedido de pagamento Protocolo 071618 em 28/11/2013 as 14:36 o mesmo tivemos informação DR ALINDO da Secretaria de Esporte Lazer , que não sabem onde se encontra OU SEJA SUMIL O PROCESSO, reiterado novamente Protocolo 014079 DE 13 Maio 2015,
 ATT: PEDRO PAULO PAES MAGALHAES 
 CPF:039.512.307.03
 SOCIO GERENTE DA PH PAES CONSTRUÇÕES LTDA         "
http://http://www.ouvidoriadoservidor.gov.br,https://cidadao.reclameaqui.com.br/342603/ministerio-do-planejamento/nao-consigo-desbloqueiar-a-senha-do-sicag/,nao consigo  desbloqueiar a senha do sicag ," 
        mja fui na upag nao consegui falaram que iam desbloquear e ate hoje3 nao desbloqueiara,         "
http://http://www.ouvidoriadoservidor.gov.br,https://cidadao.reclameaqui.com.br/336865/ministerio-do-planejamento/desbloqueio-usuario-sigac/,Desbloqueio usuario sigac ," 
        ~Meu contato com a sigepe foi bloqueado e não consigo o desbloqueio de usuário. Solicito orientações.         "
http://http://www.ouvidoriadoservidor.gov.br,https://cidadao.reclameaqui.com.br/307900/ministerio-do-planejamento/sigepe/,SIGEPE ," 
        Luderitz luderitz@gmail.com
Anexos15:41 (Há 7 minutos)
para sigepe 
Ao SIGEPE - Consignações
Boa tarde!
Estou tentando reclamar sobre novo desconto (72) na minha folha de pagamento, realizado pelo ITAU/BMG em novembro de 2016, após este financiamento ter sido quitado, integralmente, em outubro de 2016 (conforme anexo), mas não estou conseguindo registrar a reclamação, pois o site da SIGEPE devolve dizendo que já existe reclamação registrada!
Realmente houve a suspensão do desconto! A nova consignatária deve incluir agora no mês de dezembro de 2016 o novo valor da portabilidade!
O desconto indevido feito pelo ITAU/BMG sobre o salário de outubro (73) já foi devolvido!
O desconto indevido feito pelo ITAU/BMG sobre o salário de novembro 2016 (72), ainda não foi devolvido, até esta data!
Seguem anexos:
1. - quitação da dívida;
2. - contracheque de outubro, já devolvido o desconto (73);
3. - contracheque de novembro - ainda não ressarcido (72).
Atenciosamente
Francisco José Luderitz de Medeiros
CPF: 03875903153
SIAPE: 28254         "
http://http://www.ouvidoriadoservidor.gov.br,https://cidadao.reclameaqui.com.br/333100/ministerio-do-planejamento/erro-no-contra-cheque/,ERRO NO CONTRA CHEQUE ," 
        BOM DIA MEU FILHO E PENSIONISTA DO MINISTERIO  DO TRABALHO  E NO CONTRA CHEQUE DELE CONSTA TEMPORARIO INPEDINDO DE  MUITOS BANCOS NAO ACEITAREM TEMPORARIOS    ME DIRIGIE AO ORGAO DO MINISTERIO E ME DERAM UMA CARTA DIZENDO QUE ELE E VITALICIA SO QUE OS BANCOS NAO ACEITAM TENHO DOCUMENTO DO MINISTERIO DA FAZENDA DO PERITO DIZENDO QUE A PENSAO DELE E VITALICIA  O MINISTERIO ME INFORMOU QUE NAO SAO ELES QUEM COLOCA TEMPORARIO OU VITALICIA VOCES PODEM NOS AJUDAR MEU EMAIL E LPDS551@GMAIL.COM MEU TELEFONE E 21994186845 LUCIENE MEU FILHO CPF 126389327-95 LEONARDO RODRIGO DA SILVA GUERREIRO         "
http://http://www.ouvidoriadoservidor.gov.br,https://cidadao.reclameaqui.com.br/295544/ministerio-do-planejamento/margem-de-consignacao-negativa/,margem de consignação negativa ," 
        Caros Senhores,
Solicito informação sobre a razão do desconto da GEAP estar incluída na minha margem de consignação, deixando-a negativa e impedindo que eu possa fazer uma portabilidade de um Banco para a Cooperativa CREDUNI, onde tenho melhores taxas de juros e outros benefícios.
Aguardo sua resposta e agradeço suas providências, antecipadamente.
Atenciosamente,
Maria das Graças Freire de Oliveira
Profa. Aposentada- UFPB         "
http://http://www.mte.gov.br/menu/Ouvidoria/Conteudo/OuvidoriaGeral.asp,https://cidadao.reclameaqui.com.br/355819/ministerio-do-trabalho-e-emprego/telefone-158/,Telefone 158 ," 
        Este telefone 158 é muito ruim de fazer contato, ele constantemente diz que número não existe, 90% das ligações diz que número de tel não existe, e quando conseguimos falar diz que os atendentes estão ocupados. Estou desde 9:30 tentando falar e já são 10:30 e nada. Fora outros dias que também tentei sem sucesso.
Vocês precisam melhorar este atendimento, gostaria de tirar uma dúvida sobre a minha carteira de trabalho e não consigo contato. É brincadeira este nível de serviço que é prestado pelo ministério do trabalho.         "
http://http://www.mte.gov.br/menu/Ouvidoria/Conteudo/OuvidoriaGeral.asp,https://cidadao.reclameaqui.com.br/353490/ministerio-do-trabalho-e-emprego/imdiguinado-com-essa-demora-pesso-que-me-de-atencao-sobre-me/,imdiguinado com essa demora pesso que me de atençao sobre meu reembolso seguro desemprego ," 
        Pesso ajudá pra resolver minha questão .
Asunto:solicitação de reembolso de parcelas (pagas por compensação)
Estou muito insatisfação e chateado com toda essa demora 
Dei entrada no ministério do trabalho de São João de mérito na rua :selim e azul n.90 centro/sem. RJ
21 2752 5891.responsavel Rodrigo siente do ocorrido. 
Dei entrada com documentos judicial para receber as parcelas no dia 11/07/2017 e tô desempregado precisando do dinheiro do seguro desemprego Pesso que me ajude pra agilizar minha vida .até agora não te vi nenhum parecer 
Meu nome : agelson da silva França filho
Cpf:111.180.817.14
Pis:190.17511.49-7
Protocolo do recurso 4014170965 número posto atendimento:3323043-9 motivo recurso:506 
Inscrição autorizada:33231396-4
Tô muito insatisfeito com toda essa demora tô precisando tô desempregado meu email:agelsonf@gmail.com
Pesso que tome uma providência por favor
https://cidadao.reclameaqui.         "
http://http://www.mte.gov.br/menu/Ouvidoria/Conteudo/OuvidoriaGeral.asp,https://cidadao.reclameaqui.com.br/352686/ministerio-do-trabalho-e-emprego/recurso-do-seguro-desemprego/,Recurso do seguro desemprego ," 
        Quero saber quanto tempo demora pra um recurso motivo 909.
Pois já tem mais de 120 dias e nem saiu o parecer.
Estou aguardando uma resposta.         "
http://http://www.mte.gov.br/menu/Ouvidoria/Conteudo/OuvidoriaGeral.asp,https://cidadao.reclameaqui.com.br/355263/ministerio-do-trabalho-e-emprego/recurso-seguro-desemprego/,RECURSO SEGURO DESEMPREGO ," 
        Dei entrada em meu seguro desemprego no dia 03/02/2017, onde tive direito a 5 parcelas e recebi a primeira no dia 06/03/2017 normalmente, quando fui receber a segunda, a mesma estava bloqueada e a caixa me mandou ir no ministério do trabalho porque é só lá que resolveria e eles desbloqueariam, agendei e a demora foi de 60 dias pra conseguir ser atendido, no dia 08/05/2017 estive no ministério do trabalho que fica na Rua: Martins de Fontes,109 onde fui informado que teria que entrar com o recurso pra liberação das minhas parcelas, disseram que foi bloqueada por divergência cadastral e que após 60 dias me dariam retorno. Hoje é dia 28/11/2017 , já irá fazer 7 meses que estou esperando uma resposta e nada, entro em contato no número 158 e informam que não consta nada lá, anexei o papel que me deram com número do ofício, pis, nome, motivo, data e prazo de solução do recurso, peço que resolvam, trabalhei 3 anos e 7 meses e é meu direito receber meu seguro, isso é um descaso conosco, vocês não dão resposta, simplesmente deixam pra lá, solucionem isto por favor, quero receber meu seguro! 
Se eu dependesse desse seguro pra comer eu morreria de fome!! 
PIS: 2011455954-0         "
