orgao,link,titulo,reclamacao
http://www.mc.gov.br ,https://cidadao.reclameaqui.com.br/229409/ministerio-das-comunicacoes/correios-exemplo-de-degradacao-a-preco-de-ouro/,CORREIOS EXEMPLO DE DEGRADAÇÃO A PREÇO DE OURO ," 
        Os CORREIOS cada dia que passa cobra mais caro e piora seus serviços, moro em Vila Valqueire, Rio de Janeiro, um bairro calmo e seguro e ainda a sim não estou recebendo minhas contas e correspondências em dia. O carteiro Sr. Alcir é excelente mas quando fica doente ou entra de férias os CORREIOS colocam para substituir pessoas totalmente despreparadas das terceirizadas (apadrinhadas) e é o caos total !!!!!!!
O BRASILEIRO É ESCRACHADO PELO PUBLICO E PRIVADO !!!!!!!         "
http://www.mc.gov.br ,https://cidadao.reclameaqui.com.br/295590/ministerio-das-comunicacoes/nao-recebimento-do-ar-correspondencia-enviada/,Não recebimento do AR correspondência enviada ," 
        Somos da Imobiliária Catarina Imóveis na cidade de Sete Lagoas/MG.
Enviamos uma Carta Extra Judicial a um Cliente, claro no aguardo do retorno do AR..porém, não houve retorno.Considerando o fato de que precisamos entrar com Ação de despejo deste Cliente é necessário ter anexado esse ""AR"". Entramos em contato com os correios mais os mesmo não nos passam uma previsão de recebimento da 2ª via do AR.
A partir do momento que pagamos um valor a mais para envio de uma correspondência especial, fica difícil, qaundo na hora em que mais precisamos do Serviços de um Órgão como os CORREIOS, não obtermos atendimento a contento.
Precisamos urgente de uma solução.
No aguardo 
Patrícia G. Ciaccio
IMOBILIÁRIA CATARINA IMÓVEIS - SETE LAGOAS MG         "
http://www.mc.gov.br ,https://cidadao.reclameaqui.com.br/346223/ministerio-das-comunicacoes/pagamento-nao-realizado/,Pagamento não realizado ," 
        O pagamentos dos aposentados e pensionistas do Ministério das Comunicações sempre foi feito no primeiro dia útil do mês. Porém até o momento o pagamento deste mês não entrou. Não há nenhuma informação disponibilizada justificando o atraso. 
O site (que mudou, diga-se de passagem) está indisponível. Telefonei ao Ministério em São Paulo e o atendente disse que é normal o atraso (nunca!) e que eu aguarde pois alguma hora o pagamento vai sair. Não tenho onde reclamar. Dependo dessa pensão para comer e comprar medicamentos. Por favor alguém me informe o que está acontecendo.         "
http://www.mc.gov.br ,https://cidadao.reclameaqui.com.br/283917/ministerio-das-comunicacoes/nao-respondem-a-mensagens/,Não respondem a mensagens ," 
        Faz 1 ano que mandei mensagens e pedido de esclarecimentos e ajuda em relação à Claro e até hoje não responderam às mensagens.         "
http://www.mc.gov.br ,https://cidadao.reclameaqui.com.br/230126/ministerio-das-comunicacoes/mau-servico-dos-correios/,Mau serviço dos Correios ," 
        Os Correios atualmente faz pouco caso do consumidor. Minha encomenda ""PD167874082BR"" tem mais de um mês e ainda não foi entregue, acho que perderam. Tem mais de 1 mês vindo de Recife/PE para Maceió/AL. Já reclamei no ""Fale com os Correios"" e na ""Ouvidoria"" (Código da Reclamação: 32367315) e nada de resolver o meu problema. Ninguém me informa nada.         "
NA,https://cidadao.reclameaqui.com.br/353280/inss-ministerio-da-previdencia-social/registro-de-contribuicoes-previdenciarias/,Registro de Contribuições Previdenciárias ," 
        Prezados,
Houve uma mudança no sistema informatizado da previdência, que gerou o desaparecimento de vários registros de contribuições efetuados em períodos anteriores a 2003. Verifiquei isto, pois no antigo sistema estava tudo muito bem registrado, e pelo que constatei, estas inconcistencias ainda não foram corrigidas, que acredito sejam possíveis de serem resgatadas, a partir de processamento de dados da Base de dados anterior a nova versão. Solicito prazo para solução desta pendência, com o objetivo de melhor atendimento aos contribuintes, sem a necessidade de haver perda de tempo quando no atendimento presencial nos postos da Previdência Social, assim como uma melhor eficiência nos processos internos da instituição.
Atc.
Marco Tobler
NIT: 11427987690         "
NA,https://cidadao.reclameaqui.com.br/354600/inss-ministerio-da-previdencia-social/resposta-da-minha-posentodoria/,RESPOSTA DA MINHA POSENTODORIA ," 
        EU IVONE MARIA SANCHES, DEI ENTRADA NO DIA 03/10/17 NA AGÊNCIA DE CARAPICUIBA/SP NA MINHA APOSENTADORIA, E ATÉ O PRESENTE MOMENTO, DIA 22/11/17, NÃO TIVE RESPOSTA, JÁ FALEI NO 135 E FIZERAM UMA RECLAMAÇÃO NA OUVIDORIA, MAS NEM ASSIM CONSIGO SABER O RESULTADO., ACHO QUE TENHO DIREITOS DE SABER, POR FAVOR ME ENVIE ESTE RESULTADO, POIS O TEMPO DE ESPERA É SOMENTE DE 45 DIAS.
GRATA,
IVONE MARIA SANCHES         "
NA,https://cidadao.reclameaqui.com.br/354778/inss-ministerio-da-previdencia-social/inss-ouvidoria-e-apoia-as-instituicoes-bancarias/,Inss ouvidoria e apoia as instituições bancárias ," 
        Ouvidoria completo descaso, fiz várias reclamações, a resposta é sempre automática Indeferida, tenho um desconto junto ao banco  Pan sobre o título do EMPRÉSTIMO E SOBRE RMC 128,90 no valor de 128,90, o banco alega que fiz o empréstimo, então solicitado o contrato o mesmo envia um contrato de de cartão de crédito de 1988 o qual foi foi cancelado, sendo que o desconto foi reclamado e de setembro de último, como se eu o fizesse pois nunca foi feito ou solicitado, mas então se eu não o fiz por onde eu esta o contrato assinado e onde foi tal valor foi creditado          "
NA,https://cidadao.reclameaqui.com.br/353114/inss-ministerio-da-previdencia-social/atendimento/,ATENDIMENTO ," 
        Com o falecimento do meu pai, fui com a minha mãe que tem 87 anos para solicitar a pensão por morte. Aqui em Sete Lagoas/MG, o INSS só envia as pensões para o Banco Mercantil, que tem um atendimento horrível, que gasta em média 02:30 (duas horas e meia) para cada atendimento. A minha mãe já possui conta no Bradesco. É um absurdo o INSS não enviar a pensão, para o banco que o contribuinte solicita. Vcs não sabem o que é levar uma pessoa idosa de 87 anos com dificuldade de locomoção, à uma instituição financeira que não tem menor respeito com as pessoas.         "
NA,https://cidadao.reclameaqui.com.br/353257/inss-ministerio-da-previdencia-social/descaso-por-parte-do-dr-zied-zaror-medico-perito-do-inss-a/,Descaso por parte do Dr. Ziéd Zaror - Médico Perito do INSS - Agência Centro - São Gonçalo - RJ ," 
        Bom dia ,
Ontem (09/11/20127) estive na Agência - Centro - São Gonçalo para fazer Perícia Médica agendada para 10:00 hs , como sempre atraso , fui chamado a Sala 40 onde o Dr.Ziéd Zaror - ""Médico Perito"" disse-me logo ao entrar na sala que não iria me atender , pasmem , esta já é a 3ª vez que ele faz isso , alegando inicialmente que por já ter me concedido Benefício , de que não poderia me atender.
Pois bem , retruquei dizendo-lhe que meu Cardiologista Dr.Jaime Borges de Freitas que também é ligado ainda ao INSS na mesma Agência , falou-me nesta mesma data em consulta com ele pela manhã de que o Dr.Ziéd estaria errado em proceder desta maneira.
Novamente o Dr.Ziéd Zaror já exaltado , reiterou de que não me atenderia porque tem ""laços"" comigo , ora , não sou seu parente , muito menos seu amigo , colega , etc , portanto falei-lhe isso , onde o mesmo ainda mais exaltado disse-me para me retirar da sala ou chamaria a Segurança , como sempre fazem com os pacientes.Resolvi sair da sala , revoltado , e fiquei durante mais de 1 hora até que o outro ""colega"" me chamasse na sala 48 para atender-me , ou seja, é um total descaso com quem contribuiu mais de 24 anos para a Previdência Social , e hoje doente , com vários problemas de saúde é tratado desta maneira , onde deveria ser ao contrário , estava com pressão alta , passando mal e tive este tipo de atendimento , além de ainda correr o risco de não ter o Benefício deferido por este ""Órgão"".
Informo que estou levando meu caso onde for preciso , até encontrar respaldo para punição deste ""cidadão"" , não vou descansar enquanto não enquadrá-lo em algum Artigo que o faça pagar pelo seus atos anti-profissionais.
Espero alguma resposta desta ""Instituição"" , pois saibam que já enviei estes fatos a vários setores da Medicina Brasileira , uma hora alguém vai olhar e indagar quem realmente tem razão , apurando tais fatos.
Ayrthon Pinheiro
ID 05184555-0 / CPF 481471767-91 
21 973744286/37064592         "
http://http://www.dac.gov.br/principal/index.asp,https://cidadao.reclameaqui.com.br/225477/ministerio-da-defesa/termo-de-retencao-n-163-15/,TERMO DE RETENÇÃO N 163 / 15 ," 
        Minha mercadoria de categoria postal E.M.S Npc: EA136424123CN: Detector de metal para hobby/ com volume pesando apenas 1 kg (praticamente um brinquedo). Foi retido com base nos artigos 35 e 36 do decreto n 3665/2000 que dizem: Art. 35. A Receita Federal prestará aos órgãos de fiscalização do Exército toda a colaboração necessária.
Art. 36. São atribuições da Receita Federal:
I - verificar se as importações e exportações de produtos controlados estão autorizadas pelo Exército; e
II - colaborar com o Exército no desembaraço de produtos controlados importados por pessoas físicas ou jurídicas, ou trazidos como bagagem.
veja em: http://www.planalto.gov.br/ccivil_03/decreto/D3665.htm
MAS NO ARTIGO OITAVO DIZ: Art. 8º A classificação de um produto como controlado pelo Exército tem por premissa básica a existência de poder de destruição ou outra propriedade de risco que indique a necessidade de que o uso seja restrito a pessoas físicas e jurídicas legalmente habilitadas, capacitadas técnica, moral e psicologicamente, de modo a garantir a segurança da sociedade e do país.
NESTES TERMOS, PEÇO ENCARECIDAMENTE A LIBERAÇÃO DO MEU BRINQUEDO! E SE ALGUÉM DA ÁREA JURÍDICA PODERIA ME AJUDAR COM ORIENTAÇÕES NESTE PROCESSO SE FOR PRECISO IR NA JUSTIÇA!!!?         "
http://http://www.dac.gov.br/principal/index.asp,https://cidadao.reclameaqui.com.br/226246/ministerio-da-defesa/demora-entrega-de-resultado-de-exames/,DEMORA ENTREGA DE RESULTADO DE EXAMES ," 
        Prezados, bom dia!
Minha mãe de 70 anos de idade,  é paciente oncológica do Hopsital Central do Exército, e no dia 02 de março, ao comparecer para consulta de rotina para realização de quimioterapia, relatou as fortes dores que sentia a médica, e esta a encaminhou para emergência para realização de exames de tomografia. Pois bem! Realizado todos os exames, nos foi informado que o laudo demoraria aproximadamente 03 meses para ficar pronto, haja vista que tal serviço foi terceirizado. Ou seja, minha mãe continua sentindo fortes dores, deseja se consultar com outro médico, todavia, não possui os exames para  ajudar no diagnóstico das dores.
Ressalto que várias foram as vezes que comparecemos ao Hospital para verificar se já houve o retorno do laudo e sempre nos é informado que não esta pronto e que o prazo de entrega é de 03 meses.
Isso é um absurdo, como demorar 03 meses para entregar o resultado de um exame.
Sendo assim, fico no aguardo de um posicionamento por parte do nosso Exército Brasileiro.
Atenciosamente,
Amanda         "
http://http://www.dac.gov.br/principal/index.asp,https://cidadao.reclameaqui.com.br/230069/ministerio-da-defesa/orgaos-do-ministerio-da-aeronautica-burocraticos-e-inoperant/,ÓRGÃOS DO MINISTÉRIO DA AERONÁUTICA : BUROCRÁTICOS E INOPERANTES ! ," 
        Sou residente na cidade de São Lourenço/MG. É sabido e notório que esta cidade situa-se em uma região geográfica de grandes altitudes, localizada na Serra da Mantiqueira.
Resido em frente à um local turístico denominado de ""Montanha Sagrada"", pela sua altitude e matas exuberantes.
Pois bem, justamente no topo desta montanha e de mais outra também próxima a minha casa, existem duas torres altíssimas e ambas sem nenhum tipo de iluminação. Pasmem V.Sas ! Nenhuma iluminação mesmo !!!!
Temos na cidade durante quase todo o dia, vôos panorâmicos/turísticos, isto sem falar em outras aeronaves que por aqui passam.
Temendo que o pior aconteça,ou seja,uma colisão com uma destas torres às escuras, imediatamente procurei a ANAC, que alegou que não era de sua competência esta questão. Então, orientou-me a procurar o DECEA. Assim o fiz. Mas, para não fugir à regra do péssimo serviço público do Brasil, o DECEA também me informou que não era com ele. Disse-me que eu deveria entrar em contato com o lll COMAR. Eis cópia da resposta que recebí do DECEA: 
"" Prezado usuário,
seu relato foi direcionado ao III COMAR.
Segundo a Portaria 256/GC5, de  maio  de 2011, em seu Artigo 95, item V, 
a competência para exigir ou dispensar a sinalização de um obstáculo é do III COMAR, sob cuja jurisdição está o 
Estado de Minas Gerais"".
Mais uma vez, lá fui eu desta vez contactar o lll COMAR. Em sua resposta, este órgão me fez solicitações absurdas tais como: fotos das torres, endereço(????),fotos de satélite,proprietário(chega a ser cômico). Eis a resposta do lll COMAR:
"" Prezados Senhores,
Complementando a resposta anterior, esclareço sobre a necessidade de envio por parte do cidadão da denúncia em forma de Carta, uma vez que precisaremos desse documento para compor, se for o caso, processo administrativo para apuração de eventuais infrações.
Dessa forma, dirijo-me ao Sr. Ciro, solicitando-lhe que envie uma carta com a denúncia em tela ao Exmo. Sr Comandante do III COMAR (endereço abaixo), anexando o máximo de dados possível, tais como, foto da torre, endereço ou localização aproximada, imagem do Google Earth com coordenadas aproximadas, proprietário (se for possível identificar) etc.
Somente a partir desse documento, poderemos acionar a Prefeitura Municipal e tomar as demais medidas já informadas.
Endereço do III COMAR:
Praça Marechal Âncora, 77 - Castelo
Rio de Janeiro - RJ- CEP 20021-200
Att,
Cap Eng RÔMULO
III COMAR / SERENG-3 ""
Finalizando, penso que talvez se eu tivesse procurado apresentadores de TV como o Datena ou Marcelo Rezende, tivesse solucionado este problema. E notem, que eu só quero ajudar e contribuir para que acidentes evitáveis aconteçam.
Este é o meu Brasil ! Que vergonha !
CIRO R. NETO :.         "
http://http://www.dac.gov.br/principal/index.asp,https://cidadao.reclameaqui.com.br/303392/ministerio-da-defesa/viuva-de-85-anos-ha-3-meses-sem-receber-pensao-do-falecido-m/,viuva de 85 anos há 3 meses sem receber pensao do falecido marido militar da aeronautica. ," 
        PREZADOS SENHORES.
EM AGOSTO/2016 FIZ UMA RECLAMAÇÃO AO COMANDO DA AERONÁUTICA DE QUE A VIÚVA GERALDINA DE SÁ MATOS (85 ANOS) TINHA RECEBIDO A PENSÃO DE JULHO/2016 E NÃO LHE PAGARAM O MÊS DE JUNHO/2016.
POIS PARECE QUE COMO CASTIGO PELA RECLAMAÇÃO NÃO LHE PAGARAM O MÊS DE JUNHO/2016 E TAMBÉM O DE AGOSTO/2016 E SETEMBRO/2016.
ISTO É VERGONHOSO PARA UMA FORCA ARMADA (AERONÁUTICA) TÃO CONCEITUADA NO POVO BRASILEIRO.
AO APURAR ESTA RECLAMAÇÃO, DEVERIAM FAZER TAMBÉM UMA AUDITORIA PARA DESCOBRIR ESTES MAUS SERVIDORES QUE FLAGRANTEMENTE ESTÃO AGREDINDO O     ""ESTATUTO DO IDOSO""       E POSSIVELMENTE DEVEM EXISTIR MAIS VIÚVAS IDOSAS NESTAS CONDIÇÕES.         "
http://http://www.dac.gov.br/principal/index.asp,https://cidadao.reclameaqui.com.br/307428/ministerio-da-defesa/viuva-de-militar-da-aeronautica-falecido-em-10-06-2016-nao-r/,viuva de militar da aeronautica falecido em 10/06/2016 não recebeu o salario de junho/2016. ," 
        PREZADOS SENHORES.
RECLAMEI A FALTA DE PAGAMENTO (JUNHO,AGOSTO E SETEMBRO) DA SRª   GERALDINA DE SA MATOS VIUVA DO SGTO MATOS.
FALECIDO EM 10/06/2016 NO HCA DO RIO DE JANEIRO.
APOS RECLAMAÇÃO O PIPAR DO RIO DE JANEIRO EFETUOU OS PAGAMENTOS DE AGOSTO/2016 E SETEMBRO/2016.
ATE A PRESENTE DATA NÃO FIZERAM O PAGAMENTO DE JUNHO/2016 + 50% DO 13 SALARIO.
GOSTARIA QUE ME ORIENTASSEM O QUE A VIUVA DEVE FAZER PARA RECEBER ESTE CITADO MES.
ATENCIOSAMENTE,
JOÃO LUIZ DE MATOS - FILHO DO SGTO MATOS.         "
http://portal.ouvidoria.fazenda.gov.br/ouvidoria,https://cidadao.reclameaqui.com.br/351821/ministerio-da-fazenda/lamentavel-o-atendimento-so-e-presencial/,Lamentável! O atendimento só é presencial? ," 
        Estou tentando regularizar minha situação há dois meses, fazendo visitas semanais a RFB e PGFN, sem lograr êxito, por falta de informação dos atendentes.
Nós cidadãos nos sentimos humilhados por quem tem obrigação moral de nos fornecer orientação, já que estão lá para este fim.
No dia 19 de setembro efetuei o pagamento integral da DARF em Banco credenciado cujo dever seria efetuar o repasse como de costume. Contudo, o caixa cometeu um erro ao não indicar no campo específico o nr de referência necessário para o repasse.
Aí se deu início ao meu flagelo.
Depois de aguardar o tempo necessário fui ao 7º Tabelionato afim de pagar os emolumentos e liberar do protesto o nome da empresa da qual sou sócio majoritário. Fui informado que não haviam recebido a informação do pagamento para emissão do boleto. Retornei ao Banco e após alguns dias este me informou que deveria me dirigir ao RFB-PGFN com cópias xerox e formulário REDARF  (inclusive com senha prévia)Para regularizar o campo que havia sido negligenciado pelo operador de caixa. Assim o fiz!
Após mais alguns dias, fui informado que havia sido aceita minha solicitação pelo analista da RFB e que deveria comparecer a PGFN para enfim regularizar o anúncio do recebimento da DARF e, consequente liberação do boleto para pagamentos dos emolumentos no tabelionato.
É SOMENTE ISSO QUE NECESSITO, MAS DESDE ENTÃO ESTOU SENDO JOGADO DE UM LADO PARA O OUTRO!
Quem vai me ressarcir todo tempo perdido quando chegar ao final desta saga?
O MF tem objetivos claros como podemos ver logo abaixo (texto retirado de sua página):
""O Ministério da Fazenda (MF), objetivando maior visibilidade e transparência às suas ações, apresenta sua Carta de Serviços com informações claras e precisas sobre os principais serviços prestados aos cidadãos-usuários pelos órgãos fazendários.
Por configurar-se como um dos órgãos centrais da administração pública, o MF acredita que o compromisso aqui estabelecido será de suma importância para aperfeiçoar a gestão de seus serviços e principalmente a relação com a sociedade, fortalecendo assim, o equilíbrio fiscal e tributário, combatendo práticas nocivas à economia, bem como a sonegação e o desequilíbrio social.
O MF atua por meio dos seus órgãos específicos singulares, órgãos colegiados e entidades vinculadas, que abrangem assuntos diversos, dentre os quais se destacam: moeda, crédito e instituições financeiras; política, administração, fiscalização e arrecadação tributária federal, inclusive a destinada à previdência social, e aduaneira; administração financeira e contabilidade pública; dívida pública - interna e externa; negociações econômicas internacionais; preços em geral; tarifas públicas e administradas; fiscalização e controle do comércio exterior; e acompanhamento da conjuntura econômica e prevenção e combate à lavagem de dinheiro e ao financiamento do terrorismo.""
Será que podemos crer na visibilidade e transparência quanto aos serviço prestado ao cidadão que é a pedra basilar da existência deste e dos demais órgãos?
Espero, sinceramente, que os senhores possam me auxiliar nessa minha dura jornada.
Obrigado!
Manoel Paulo         "
http://portal.ouvidoria.fazenda.gov.br/ouvidoria,https://cidadao.reclameaqui.com.br/351840/ministerio-da-fazenda/ouvidoria-da-receita-federal-ineficiente-e-servico-de-libera/,Ouvidoria da Receita Federal Ineficiente e Serviço de Liberação de Encomendas Internacionais Lenta!! ," 
        Quero registrar minha indignação com relação ao Atendimento da Ouvidoria da Receita Federal e da demora em liberar um objeto que comprei da Rússia. Acredito que se esses servidores da RFB fossem da iniciativa privada seriam mandados embora por justa causa por ineficácia. Totalmente fracos e ineficientes e ao invés de tentarem resolver as demandas, irem atrás, investigar o que houve ou se a encomenda foi extraviada simplesmente dão respostas copiadas/coladas que não ajudam em nada ainda irritam o contribuinte. Estou ha meses tentando resolver problemas sérios que ocorreram com encomendas importadas por mim e ninguém resolve. Vou explicar meu caso para que o cidadão que está lendo esse texto veja quão lixo e ineficaz é o serviço publico brasileiro, e acredito que a Receita Federal Brasileira é um dos órgãos mais ineficazes e lentos do mundo. Nas respostas que obtive da ouvidoria sempre repetem que falta funcionários e por isso o atraso na liberação das encomendas. Não tenho nada a ver com falta de funcionários. Todo objeto importado é cobrado taxa de 60% sobre o preço do produto + 18% de ICMS. Ora se falta funcionários que abram concurso para contratar mais! Ou se quiserem mesmo melhorar os serviços que terceirizem o serviço e demitam esses servidores ""raposões"" que ganham salários astronômicos para serem ineficazes no serviço que prestam. Meu problema é que comprei um produto rastreio EP058715006RU ha cerca de 3 meses da Rússia. O produto ficou retido na Receita Federal por incríveis 1 mês, apos isso voltou para o setor de desembaraço aduaneiro dos correios (GEARA), paguei os tributos normalmente (Procedimento 244668) e acreditem! O objeto retornou para Receita Federal para avaliação (Situação: Remessa em Avaliação RFB). !!! Conhecendo o serviço lixo e lento prestado pela Receita Federal Brasileira já estou em desespero pois calculo 4 ou 5 meses para que me entreguem esse item. Entro em contato para informar que se não entregarem meu objeto com rapidez irei até a Receita Federal onde minha encomenda está parada me acorrentarei na frente do prédio da RFB, chamarei a imprensa e contarei toda história. Nunca ninguém tomou uma atitude extrema como essa, mas irei fazer pois não aguento mais esperar pelo objeto EP058715006RU.         "
http://portal.ouvidoria.fazenda.gov.br/ouvidoria,https://cidadao.reclameaqui.com.br/352736/ministerio-da-fazenda/processo-de-ipi-para-pcd/,Processo de IPI para PCD ," 
        Boa Tarde, Sou o Julio Cesar Amorim, depois de uma longa luta para tirar a CNH Especial, por fim cheguei ao próximo passo, dar entrada no processo de IPI, esse que foi dado entrada junto a Receita Federal no dia 10/07/2017, o seja 4 meses, já espera esse tempo, até mesmo através de pesquisas na internet. Essa é a minha primeira vez, até mesmo porque não sabia desse meu direito, em fim, apos 4 meses, não tenho resposta, nos posto da Receita Federal, só é passado que o processo demora mesmo, que devo aguarda, através do site a 4 meses mostra a mesma coisa, sem movimentação nenhuma. Então assim, estou muito insatisfeito com isso, pelo fato que preciso do carro para facilitar mais as coisas, e simplesmente me vejo refém, de mãos atadas, sem poder fazer nada. Pedem para aguardar, mais até quando?
Tenho amigos Taxistas, que o processo de IPI saiu em 3 dias, questionei isso na Receita Federal e foi passado que para taxista o processo mudo, e que agora pode ser solicitado através da internet, não precisa nem comparece no posto da Receita.
Será que isso acontece devido os taxista ter Sindicato, e o publico PCD não ter ninguém que possa lutar por essa causa?
Processo de Isenção: 10882.721724/2017-12
Aguardo 
Att
Julio Cesar Amorim         "
http://portal.ouvidoria.fazenda.gov.br/ouvidoria,https://cidadao.reclameaqui.com.br/352448/ministerio-da-fazenda/produto-parado-ha-2-meses-na-receita-federal/,Produto Parado Ha 2 Meses na Receita Federal ," 
        Amigos poderiam me informar se houve algum problema com o objeto rastreio EP058693950RU? Está demorando por sobremaneira. Estou com um problema sério e grave que não consegui resolver pelo Fale Com os Correios. Minha encomenda rastreio EP058693950RU foi comprada do exterior (Por EMS) ha aproximadamente 3 meses atras. Chegou ao Brasil e ficou 1 mês retida na Receita Federal. Após isso saiu da receita federal e foi para GEARA/ GESAD unidade importa fácil já que a encomenda custa mais de $500. O problema é que o produto está ha 20 dias parado na GEARA/ GESAD. Entrando em contato com a ouvidoria dos correios me informaram que o objeto voltou para avaliação da Receita Federal, só não entendi esse processo já que o objeto já havia ficado 1 mês retido na RFB conforme relatei acima. Poderiam me informar onde o objeto etá e em quanto tempo será entregue?         "
http://portal.ouvidoria.fazenda.gov.br/ouvidoria,https://cidadao.reclameaqui.com.br/356768/ministerio-da-fazenda/receita-federal-blumenal-sc-um-auditor-1-vez-por-semana/,Receita federal Blumenal SC .. Um Auditor 1 vez por semana ," 
        Meu Nome E Eder Rodrigo de souza Monteiro e Estou tentando Tirar Meu primeiro carro com insencao uma vez q sou Amputado .. Entao dei entrada na papelada no dia 11 de abril 2017 na receita de blumenal porem so protocolaram no dia 2 maio quase um mes depois , quase um mes de atraso ..  . e estamos em Dez .. Quase 7 meses Se Passaram 210 dias e nada da minha carta de ipi liguei pra receita a recepcionista eliána disse q o auditor vem uma vez por semana q o processo esta saindo com Nove mesmo .. Fiquei indginado , eles anotaram o meu numero e ahe hoje nao ligaram venho atraves desse orgao competente para finalmente obter uma resposta ... 1 auditor para todos Vale do itajai 9 meses de demora sendo q no RS sai com 10 dias ... Descaso de quem e Deficiente e precisa se locomover         "
